{
  "id": "poi",
  "title": "Points of Interest",
  "kind": "point",
  "source": { "type": "geojson", "url": "/apps/demo/data/poi.geojson" },
  "temporal": { "defaultVisibility": "time-filtered" },
  "taxonomy": [{ "id": "category", "label": "Categories", "field": "properties.category" }],
  "regionRole": null,
  "style": { "cluster": true, "icon": "marker" },
  "panel": {
    "showInSearch": true,
    "showInInfo": true,
    "infoFields": [{ "field": "properties.category", "label": "Category" }]
  }
}
