{
  "$schema": "../../../docs/schemas/layer.schema.json",
  "id": "regions",
  "title": "Regions",
  "kind": "polygon",
  "source": { "type": "geojson", "url": "worlds/demo/data/regions.geojson" },
  "temporal": { "defaultVisibility": "time-filtered" },
  "taxonomy": [{ "id": "region", "label": "Regions", "field": "properties.name" }],
  "regionRole": "boundary",
  "style": { "color": "#7a5cc4", "fillColor": "#7a5cc4", "fillOpacity": 0.16, "weight": 2 },
  "panel": { "showInSearch": false, "showInInfo": true, "showByDefault": false }
}
