{
  "$schema": "../../../docs/schemas/layer.schema.json",
  "id": "moon-photos",
  "title": "Fotos de la Luna",
  "kind": "point",
  "source": { "type": "geojson", "url": "worlds/moon-map-photos/data/photos.geojson" },
  "temporal": { "defaultVisibility": "time-filtered" },
  "taxonomy": [
    {
      "id": "moonPhase",
      "label": "Fase Lunar",
      "field": "properties.moonPhaseLabel",
      "icons": {
        "Luna Nueva": "🌑",
        "Creciente": "🌒",
        "Cuarto Creciente": "🌓",
        "Gibosa Creciente": "🌔",
        "Luna Llena": "🌕",
        "Gibosa Menguante": "🌖",
        "Cuarto Menguante": "🌗",
        "Menguante": "🌘"
      },
      "defaultIcon": "🌙"
    }
  ],
  "regionRole": null,
  "style": {
    "cluster": true,
    "icon": "marker",
    "dedupeMarkers": true,
    "imageField": "properties.moonPhaseIcon",
    "imageVariant": "phase"
  },
  "panel": {
    "showInSearch": true,
    "showInInfo": true,
    "searchFields": ["title", "tags"],
    "infoFields": [
      { "field": "properties.thumb", "label": "Foto", "type": "image" },
      { "field": "properties.moonPhaseLabel", "label": "Fase Lunar" },
      { "field": "properties.date", "label": "Fecha" },
      { "field": "properties.camera", "label": "Cámara" },
      { "field": "properties.tags", "label": "Ubicación" }
    ]
  }
}
