{
  "$schema": "../../../docs/schemas/layer.schema.json",
  "id": "paranormal-places",
  "title": "Paranormal Places",
  "kind": "point",
  "source": { "type": "geojson", "url": "worlds/paranormal-spain/data/lugares.geojson" },
  "taxonomy": [
    {
      "id": "category",
      "label": "Category",
      "field": "properties.category",
      "icons": {
        "Apariciones": "👻",
        "OVNIs": "🛸",
        "Maldiciones": "🪦",
        "Brujería": "🔮",
        "Criaturas Míticas": "🐉",
        "Monstruos Humanoides": "🧛",
        "Desastres Naturales": "🌊",
        "Tragedias": "🔪",
        "Portales": "🌀",
        "Objetos Malditos": "🗿",
        "Lugares de Poder": "⚡"
      },
      "defaultIcon": "❓"
    },
    {
      "id": "verification",
      "label": "Verification Level",
      "field": "properties.verificationLevel",
      "icons": {
        "Científicamente Estudiado": "🔬",
        "Documentado": "📰",
        "Testimonios Múltiples": "👁️",
        "Leyenda Popular": "📚",
        "Sin Verificar": "❓"
      },
      "defaultIcon": "❓"
    }
  ],
  "regionRole": null,
  "style": {
    "cluster": true,
    "icon": "marker",
    "colorField": "properties.dangerLevel",
    "colorMap": { "Baja": "#4caf7d", "Media": "#e0a83e", "Alta": "#d9534f" },
    "defaultColor": "#9aa3ad"
  },
  "panel": {
    "showInSearch": true,
    "showInInfo": true,
    "infoFields": [
      { "field": "properties.category", "label": "Category" },
      { "field": "properties.verificationLevel", "label": "Verification Level" },
      { "field": "properties.era", "label": "Era" },
      { "field": "properties.municipality", "label": "Municipality" },
      { "field": "properties.phenomena", "label": "Phenomena" },
      { "field": "properties.activityHours", "label": "Activity Hours" },
      { "field": "properties.dangerLevel", "label": "Danger Level" },
      { "field": "properties.accessibility", "label": "Accessibility" },
      { "field": "properties.bestSeason", "label": "Best Season" },
      { "field": "properties.investigators", "label": "Investigators" },
      { "field": "properties.howToGetThere", "label": "How to Get There" },
      { "field": "properties.recommendations", "label": "Recommendations" },
      { "field": "properties.fullHistory", "label": "Full History" },
      { "field": "properties.video.title", "label": "Video" },
      { "field": "properties.video.url", "label": "Watch Video", "type": "link" },
      { "field": "properties.sources", "label": "Sources" }
    ]
  }
}
