{
  "$schema": "../../../docs/schemas/layer.schema.json",
  "id": "poi-heatmap",
  "title": "POI Density",
  "kind": "heatmap",
  "source": { "type": "geojson", "url": "worlds/demo/data/poi.geojson" },
  "temporal": { "defaultVisibility": "time-filtered" },
  "regionRole": null,
  "style": {},
  "panel": { "showInSearch": false, "showInInfo": false, "showByDefault": false }
}
